{
  "id": "photo03",
  "contract_version": "1.0",
  "rig": {
    "parts": {
      "head": {
        "file": "parts/head.png",
        "pivot": [
          254,
          137
        ]
      },
      "body": {
        "file": "parts/body.png",
        "pivot": [
          249,
          189
        ]
      },
      "arm_l": {
        "file": "parts/arm_l.png",
        "pivot": [
          212,
          162
        ]
      },
      "arm_r": {
        "file": "parts/arm_r.png",
        "pivot": [
          282,
          150
        ]
      },
      "leg_l": {
        "file": "parts/leg_l.png",
        "pivot": [
          230,
          263
        ]
      },
      "leg_r": {
        "file": "parts/leg_r.png",
        "pivot": [
          271,
          263
        ]
      },
      "eye_l": {
        "file": "parts/eye_l.png",
        "pivot": [
          237,
          80
        ]
      },
      "eye_r": {
        "file": "parts/eye_r.png",
        "pivot": [
          271,
          81
        ]
      },
      "mouth": {
        "file": "parts/mouth.png",
        "pivot": [
          253,
          106
        ]
      }
    }
  },
  "persona": {
    "name": "小美",
    "setting": "由照片生成的 Q 版桌宠。"
  },
  "knowledge": [
    {
      "key": "source",
      "value": "D:\\Python\\item\\WindowPet\\Window_Pet_Generator\\photo_cartoon_instance\\apose_photo03\\rgba_seed777.png"
    }
  ],
  "idle_lines": [
    {
      "text": "你好呀！",
      "action": "wave",
      "weight": 2.0
    },
    {
      "text": "嗯……发会儿呆。",
      "action": "nod",
      "weight": 2.0
    },
    {
      "text": "哈欠……",
      "action": "yawn",
      "weight": 1.0
    }
  ]
}
